"MailboxID","DisplayName","Alias","TargetAddress","Department","Purpose","OwnerUPN","Enabled"
"MBX-001","MBX - MGMT - Info","info","info@amblogistics.be","MGMT","General external inquiries.","jan.vandamme@amblogistics.be","True"
"MBX-002","MBX - OPS - Operations","operations","operations@amblogistics.be","OPS","Transport bookings and international tracking.","emma.peeters@amblogistics.be","True"
"MBX-003","MBX - DSP - Dispatch","dispatch","dispatch@amblogistics.be","DSP","Driver communications and daily coordination.","elena.mertens@amblogistics.be","True"
"MBX-004","MBX - SUP - Support","support","support@amblogistics.be","SUP","Client issue tickets and resolution.","kevin.claes@amblogistics.be","True"
"MBX-005","MBX - FIN - Finance","finance","finance@amblogistics.be","FIN","Invoicing, payments, and payroll.","luc.wouters@amblogistics.be","True"
"MBX-006","MBX - HR - Human Resources","hr","hr@amblogistics.be","HR","Recruitment and staff queries.","sophie.maes@amblogistics.be","True"
"MBX-007","MBX - SAL - Sales","sales","sales@amblogistics.be","SAL","Quotes and sales leads.","sarah.jacobs@amblogistics.be","True"
"MBX-008","MBX - IT - Tech Support","it","it@amblogistics.be","IT","Internal support and technical governance.","bram.willems@amblogistics.be","True"
